
<!ELEMENT employees (employee+)>
<!ELEMENT employee (Username, Password)>
<!ELEMENT Username (#PCDATA)>
<!ELEMENT Password (#PCDATA)>
<!ATTLIST employee Empid ID #REQUIRED>